,reviews,Prediksi
0,"Membosankan belanja di lazada sekarang 2025, tidak ada gratis ongkir, kadang ongkir lebih mahal dari harga.",netral
1,"Tolong dong aktifin lagi paylater saya, biar nyaman pake lazada selamanya",netral
2,"Permisi untuk pihak lazada saya mau beli tas di lazada awalnya normal saja dengan harga Rp 73.000 tapi pas saya lihat ongkirnya, ongkirnya itu malah mahal sekitar Rp 6000.000 an , mohon di atasi lebih lanjut terimakasih",netral
3,"barang sesuai pesanan, pengiriman cepat dan gratis ongkir lgi. ðŸ‘",positif
4,"Pertahankan dengan ongkir mahalnya ya, biar saya gak kalap belanja terus. dengan ongkir mahal saya jadi malas belanja dong, seneng deh duitku bisa ditabung heheheee",netral
5,"hapus aja event Lazpanen dan sejenisnya itu semua cuma gimick giliran mau di claim sedikit lgi malah di persulit, udah gitu pelit bngt sama voucher nya minimal voucher nya banyak lah kaya sebelah ini mah udh banyak gimick pelit voucher penjualan rendah hadeh",netral
6,"Susah untuk mengaitkan akun. Pertama membuat akun sudah dibekukan dengan alasan ""kemanan akun"". Mohon untuk ditindaklanjuti ðŸ™",negatif
7,"apk gajelas padahal sinyal lancar kuota banyak, malah bug truss",netral
8,jangan mau instal apk gj ke gini gak di mana mana muncul terus iklan lazada yg belom dowload juga udah kerasukan iklan lazada apa lagi gua yg udah instal apk gj.,negatif
9,"dulu lazada lumayan recommended lah tapi sekarang gila ongkir ya mehong"" mikir 2 x mau belanja juga mahalan ongkir ya drpd barang yg kita beli",netral
10,lazadah emang bikin gampang mencari barang yg kita cari manusia terus da semakin sukses lazada,positif
11,"lazada sekarang ongkir mahal, masa ia barang yang mau saya bli cuma 14 ribu ongkir nyh 11 ribu ada yg 29 ribu itu lebih mahal dari harga paket nyh saya sangat kecewa lazada mohon di perbaiki untuk masalah ongkir nyh ðŸ™",netral
12,"selalu berlangganan belanja di sini, sesuai pesanan, pengiriman. cepat bisa pke paylater pula ðŸ‘ðŸ‘",positif
13,"Lazada sekarang kok ongkirnya gak ada si, dulu minimal beli 30ribu udh dapet gratis ongkir, lah skrng gak ada sama sekali kocak. Mana penjualnya suka gk amanah kagi",netral
14,Tolong untuk lazada ditambah lagi voucher gratis ongkir nya masak makin kesini I ongkir cuma 10k doang untuk min pembelian 30rb lagi,netral
15,"Applikasi milih2,, Tidak ada fitur lazapaylater nya.. padahal semua sudah terverifikasi sesuai data !!! trims :)",positif
16,kenapa ya DI LAZADA barang memang agak murah tapi di ongkir terlalu mahal beda dengan dengan toko sebelah.makanya sudah lama tidak belanja lagi di LAZADA,netral
17,"biasanya tiap produk yang diulas dinilai 30/60 sekarang satu produk cuma 15 yang biasanya 30, ongkir minimalnya mahal banget, belum lagi pas pembelian pakai koin harga aslinya ngga ngotak banget. Akan bagaimanakah nasib Lazada selanjutnya?",netral
18,"banyak iklan yang sangat mengganggu aktivitas saya ,saya sangat merasa ternganggu dengan itu",negatif
19,"Yah jadi kacau Lazada,ongkirnya minimal belanja buat dapet free ongkir nya gede banget,gak kayak biasanya,padahal aku udah percaya betul sama lazada,mohon di murahin lagi dong lazada,Jadi jarang belanja kalo ongkir mahal kayak gini mah ðŸ¤§ðŸ¤§ðŸ¤§",netral
20,"Saya adalah orang langganan lazada.Tapi sekarang tidak, karena akun saya terkunci semua, karena semua akun saya tertaut dengan nomor HP, padahal saya sudah mencentang tulisan ""Saya bukan robot"" dan sudah menyelesaikan puzzle, dan sudah benar, tiba tiba saat saya memesan 1 barang akun saya terkunci permanen ""SEMUA"", untungnya paket saya tetap datang, tapi sekarang saya sudah tidak bisa lagi pesan di lazada, jadi pindah ke shopee aja, padahal saya sudah langganan lazada bangetðŸ˜”",negatif
21,"Sebelumnya saya sangat sering belanja di LAZADA dan penggemar berat LAZADA, namun akhir-akhir ini sudah tidak pernah lagi, karena ongkirnya melarang saya untuk belanja di LAZADA.",positif
22,"kenapa playlater saya ga bisa di pakai, padahal saya tidak punya tagihan saya selalu bayar tepat waktu. udah gitu gratis ongkirnya ga ada parah bgt lazada!!!",positif
23,"dulu sering banget belanja disini, tapi beberapa bulan terakhir aku pindah ke si ijo & oren, alasannya karena beberapa kali kena tipu seller, produk yg di iklan & deskripsi sangat beda ketika udah sampai, sering komplain tapi kok lazada seperti membiarkan & tidak menindak seller2 seperti itu. ditambah akhir2 ini udah ga pernah dapet gratis ongkir. saran untuk lazada agar penggunanya tdk beralih ke aplikasi lain, perketat lagi pengawasan terhadap toko2 yg tdk amanah, & kembalikanlah gratis ongkir",netral
24,"kayanya lazada di ambang ke bangkrutan, makin sini kiriman ga jelas datangnya, kurir kalian pada males nganter, padahal kurir 2bln yg lalu gesit, ini khusus area bojongloa kaler, pokoknya payah jadi males belanja di lazada, mending pindah ke si oren",negatif
25,saya senang berbelanja dilazada semoga sukses tambah murah harganya,positif
26,super cepat super murah untuk kali ini aku pesan ban belakang 90/90 oke makasih ðŸ‘ðŸ™,positif
27,saya suka soalnya banyak promonya,positif
28,"sbenernya aplikasi ini bagus cmn ga tau kenapa penjual yang ada di dalam aplikasi ini, rata-rata ceroboh seperti beli brang yang tidak sesuai gambar dan tidak sesuai dengan pesanan dan kejadian ini tidak 1/2 kali sering sekali apalagi seringnya di pembelian sandal/baju yang kadang salah ukuran dan warna, tolong untuk pihak lazada agar memberikan keamanan dan kenyamanan bagi pengguna lazada, dan karna kejadian ini saya jadi malas beli barang atau kebutuhan lainnya di lazada dan lari ke TT shop ðŸ™",positif
29,saya kerja jadi kurir Lex udah hampir 3 tahun gajih 1500/paket tanpa bensin tanpa apapun jauh dari expedisi lain itu ketika paket normal sekarang hitung gajih lebih besar pengeluaran BBM dari pada penghasilan. kepada lazada tolong lah perbaiki lagi manajemen nya. supaya yang belanja nyaman kurirpun jaya dan makmur,netral
30,engga engga lagi deh pake apk ini.. apalg pake lazpaylatter.. masa tlt 3 hari doang bunganya gedeee bangeett.. apk sebelah engga kayaa gituu deh tlt 3 hari jugaa..,netral
31,suka sih belanja di lazada cuma sekarang ongkir nya makin mahalðŸ˜­,netral
32,"Lazada aplikasi yang bagus walaupun ada beberapa kali di tahun 2024 transaksi bermasalah dan sudah dilaporkan ke customer care dan spesialis agent, karena kelalaian saya sendiri dalam pemakaian dan pemberian pin di email. mudah mudahan di tahun 2025 lebih baik. .",negatif
33,pelayanannya sangat memuaskan,positif
34,"pesan untuk toko di lazada ,KLO jualan amanah pesan 3 datang 1 ,barang ,mending saya apus aplikasi lazada ,mending saya beli toko orent amanah",positif
35,"menurut saya aplikasi ini memaksa sekali untuk membuka aplikasinya sendiri,aplikasi ini bisa membuat saya jadi gila karena saat saya man game terus iklan pas gak mencet apa apa langsung ke teleport ke aplikasinya",negatif
36,"saya suka belanja di Lazada,karena harga nya terjangkau dan barang nya bagus,dan mudah di dapat, terimakasih ðŸ™â™¥ï¸",positif
37,"barang bagus, pengiriman cepat",positif
38,cepat pengiriman y,positif
39,simple bgt pembayaran nya,positif
40,kenapa nggk ada COD lagi padahal aku suka banget aplikasi lazada,netral
41,kenapa akun saya tidak bisa masuk tiap kali harus hubungi cs tapi di telpon ga ada balasan..padahal saya sudah lunasi paylater saya...,negatif
42,mudah dan marang sangat menarik,positif
43,"Main lazpanen nunggu lama sebulan lebih, tiap hari bolak balik siram , giliran udah panen dapat beras nggak bisa di klaim , krena khusus untuk area jabodetabek ,sedangkan saya di jateng. Seenggak nya kasih hadiah pilihan lain , jangan cuma beras doang",netral
44,suka belanja karna harga nampol...semoga toko amanah dan tidak mengecewakanðŸ˜ŠðŸ˜ŠðŸ˜Š,positif
45,"setiap pesan belum pernah kecewa, slu siap pakai, layar setuhny Ok",positif
46,"Saya pakai paylater lazada saat saya mau bayar tidak ada menu nya, bagaimana solusinya? saya ditelpon dari lazada terus",negatif
47,saya sangat puas berbelanja dan banyak diskon nya,positif
48,"knpa tibaÂ² paylater dibekukan , pdahal sya bayar sllu tepat waktu , ditmbh ongkir skrng lebih mahal dn jarng dpt gratis ongkir , tlong ia lazada diperbaiki lagi .",netral
49,sangat membantu terima kasih lazada pantau terus pedagang nya biar yg blanja tidak kecewa,positif
50,kerennya aku cekout terus setiap hari terimakasih lazada ðŸ˜˜â™¥ï¸â™¥ï¸,positif
51,"saya sudah 5 kali kena tipu barang yang ga sesuai misal aku pesen tempat warnanya hijau tapi yang dateng warnanya biru aku coumplain sama penjual sampe sekarang belum ada jawaban, tapi kenapa aku ga kapok kapok karena di lazada murah dan juga bisa beli pake voucher juga semoga bisa di perbaiki yaa lain kali",negatif
52,makin kesini ko makin aneh sih lazada nih. masa daftar pake nomer hp trus konfirmasi email tp email itu bukan atas nama email kita .tolong di perbaiki lg kemarin2 login langsung masuk tanpa konfir email,negatif
53,lazada ongkir mahal banget nggak pernah ada gratis ongkir mana penjual disni kebanyakan nipu,netral
54,"kenapa saya tidak bisa melakuan pembayaran dengan cod,ini udah hari ke 3,udah di hapus aplikasi dan di instal ulang,tapi tetep tidak bisa melakukan pembayaran dengan cod",netral
55,rata rata pada gak niat jualan kalau di LAZADA masak CO dari tgl 1 sampai sekarang gak dikirim2.,negatif
56,top deh belanja produk di lazada,positif
57,baru pemula harapan ke depan banyak bonus nya ðŸ™,positif
58,"saya itu pengguna setia lazada,setiap hari saya check in,tiap Minggu pasti saya belanja Pampers buat anak saya,tapi setelah saya update kok malah ongkir mahal,koin dikit, minimal pembelian naik,terus potongan koin juga ga ngotak,harga di naikin,koin juga di gedein, tolong dong di perbaiki kaya lazada yang dulu, makasih",positif
59,lajada itu luar biasa sangat membantu dan pengantar pesanan pun cepat saya suka ðŸ˜Š,positif
60,bagus tolong pembayaran cod nya punya saya diaktifkan,netral
61,"setelah update, tukar lazreward setelah lihat video tidak bisa dilakukan",positif
62,belanja d lazada tdk mengecewakan,positif
63,sangat bagus dan cepat terimakasih lazada â˜ºï¸,positif
64,"lazada sekarang sering ngelag ya, padahal dulu lancar, aku buka aplikasi lain lancar semu, pas buka lazada kok sering ngelag, tak kirain sinyalku tapi ternyata tidak, padahal suka banget belanja di lazada",netral
65,"pengiriman terlalu lama,bahkan seminggu lebih belum tentu di kirim!!",netral
66,Alhmdulilah dengan adanya Lazada lebih baik dan mudah untuk berbelanja,positif
67,lebih mudah jika barang tidak ada di toko dekat rumah tinggal pesen saja di lazada,positif
68,"aplikasi terburik di dunia, ga jelas banget nih apk masa, paket gua kagak datang-datang. jelas-jelas gua ada di lokasinya, disitunya ""Penerima tidak berada di lokasi""kan ga jelas banget, gua dah nungguin lamaa bet anjirr mana kagak bisa di cancel+ nelpon kurirnyaaðŸ˜­ðŸ—¿",negatif
69,"baru kali ini coba belanja di lazada ,emng dah bagus bangat kalau belanja di sini",positif
70,kalau tidak ada biaya tambahan lebih seneng lagi ya wkkk,positif
71,"gj,pernah ketipu beli baju,dapetnya bekas,udah kek pemakaian bertahun tahun,udah coba laporin gada solusi yang baik,udah gw lupain,gw hapus,tiba tiba,lagi enak enak baca komik,malah masuk app ini,lagi scrol tiktok nge geser iklan,buat apa ada biji biji penanda geser nya,pas geser kan malah pindah alam,padahal pas sebelum itu gw yang asalnya mood gw sedang berbinar binar,lagi ketawa ketawa liat postingan org,kalo depan komuk udah gw tonjok depan muka,bisa ga sih jangan ganggu hidup gw sekali aja",negatif
72,makin kesini makin lambat pengiriman nya. yg tadi nya cmn 3-4 hari sekarang bisa sampe semingguan. padahal seller sama lokasi sama. dan sekarang bukan LEXid lgi tapi ninja. ninja tuh lemaot coooo asli,netral
73,"BEDA SAMA DULU!! . SEKARANG TIDAK ADA GRATIS ONGKIR. masa iah harus minimal 40 rb baru ada gratis ongkir, dulu 10rb jga gratis ongkir. atau 20/30rb . ya mending beli di offline ya. niat nya mau beli grosir an tapi malah ada ongkir nya ..",netral
74,semoga pesanan sesuai yang diinginkan sama seperti yang di liat di gambar ðŸ˜,positif
75,barang tidak sesuai dengan gambar..pastinya harga mahal klo sdh liat barangnya..belanja pakai paylater..telad 3 hari bayarnya tagihannya kaya mau merampok..stop pakai paylater lazada..mencekik.,netral
76,"jangan pelit gratis ongkir plis saya kangen ingin belanja di lazada lagi tapi ada ongkirnya,gak kayak aplikasi lainðŸ™",netral
77,"masih banyak penipu nya yg jualan, gratis ongkir tanpa min beli 0 rp nya jarang ada untuk sekarang, dulu saya sering banget belanja disini, tp skrng aga dikurangin karna ongkir min belanja 0 rp nya ga ada, dan selalu ketipu sm yg jualan nya",netral
78,"ud lm suka belnja dilazadah,sejk ongkir terll mhl gk kyk dl lg,jd belnja jarang"",tolong dong lazadah ongkiry dikuranginðŸ™",netral
79,menurut aku belanja disini emang murah' cuma emang kadang ada aja barang yang dateng beda dari ekspektasi kita..,netral
80,pake lazada karena aplikasinya cepat ga kayak aplikasi sebelah yg lemot,netral
81,kalo bisa dana yg di kembalikn lewat saldo atw voucher bisa di tambahkan ke barang yg di cekout..jdi tidak harus sesuai dengan saldo.. kalo lebih dari saldo tinggal byr yg kurangnyah..,negatif
82,maaf di hapus aplikasi nya mau beralih ke aplikasi lain. yang lain nya biaya ongkir nya murah jauh sama paliksi ini,netral
83,semoga selalu ada promo diskon belanja dan ongkir gratis ðŸ˜€ðŸ™ðŸ‘»,positif
84,sungguh sangat kecewa padahal tahun lalu saya sangat senang sekali belanja di lazada... tapi kemarin saya coba instal lagi di hp yang baru daftar pake wa gapernah di kasih vocer freeongkir... terus tadi saya instal ulang dan daftar lagi pake gmail malah hubungi layanan tapi layananya gak ada alias nipu dan gak bisa di hubungi.. apk sudah rusak emang?,negatif
85,"iklan nya ngeselin kyk setan gentayangan terlalu memaksa, lama"" iklannya kyk jump scare tiap mau buka game pasti ada iklan lazada, mau nonton anime juga pasti selalu muncul iklan lazada, horor bgt serasa diteror padahal udh banyak yg protes tetep aja masih muncul, heran ma rating nya kok bisa bagus padahal iklan nya ngeganggu bgt, dah la mls mending uninstall aja.",negatif
86,lebih murah dan lebih cepet dari pada yg lain,positif
87,"belanja d lazada gak ada bosennya,respon cepat dan kurirnya super ramah. thx lazada bikin belanja makin simple no ribet",positif
88,ga ada vocer gratis ongkir untuk pengguna baru!!,netral
89,"sudah 5 tahun saya setia sama lazada tapi akhir2 ini promonya makin dikit , gak ada gratis ongkir selain di choice giliran dapat voucher gak bisa dipakai dengan alasan akun terdeteksi blablabla lah bye lazada sekarang saya uninstal aplikasi gak berguna dan bangkrut ini ðŸ‘ŽðŸ‘ŽðŸ‘Ž",netral
90,"banyak toko""penipu nya yg belum lazada koreksi/di sangsi perlu hati ""dan teliti bgt belanja di lazada",positif
91,Aplikasinya sangat menyenangkan Saya suka sekalii â¤ï¸â¤ï¸â¤ï¸â¤ï¸â¤ï¸â¤ï¸â¤ï¸â¤ï¸â¤ï¸,positif
92,sangat memudahkn untuk belanja,positif
93,"Sumpah, ini jadi marketplace nomor 1 buat aku belanja. Sampe sekarang hanya belanja di lazada. sebagus itu buat belanja.",positif
94,"semenjak lex.id yg ngirim,selalu cepat dan tepat waktu,mantap",positif
95,"apaan si, mau chat seller dikit dikit pesan sensitif, benerin",netral
96,belanja di lazada oke banget,positif
97,aplikasi yang sangat membantu untuk berbelanjaðŸ¥°,positif
98,mantep ga harus repot kita jalan bisa blanja dan langsung di kirim,positif
99,keren banget lazada tapi kalau saya mau beli vape selalu ga ada kalo di adain harganya 40 ribu aja ya ðŸ˜„ðŸ˜„ðŸ˜„ðŸ˜„ mantap,positif
100,gk bsa COD lg krna kurir tidak profesional.. sehingga paket saya sllu di return tnpa alasan yg jls,netral
101,lagi lagi kecewa dengan lazada sering banget klw pesan 2 barang pasti yang datag cuma 1 barang payah udah barang yang hilang barang yang ditunggu tunggu,positif
102,"aplikasinya sudah bagus, tapi seller masih ada yg curang jual barang ga sesuai deskripsi & foto",positif
103,"baru di instal udah ku uninstal. bonus voucher dikit, g bisa pilih jasa kirim, pengguna baru ngambil bonus barang g dikirim2 toko, bukti toko g serius itu. mau blanja lagi ongkir lbih mahal daripda harga barang. ternyata g ad aplikasi blanja yg lbih asik drpd si orange. dsana gratis ongkir asli melimpah. estimasi pegiriman jelas, pengembalian dana mudah, bisa pilih2 jasa kirim. beda jauh klo dsini pihak toko n aplikasi sma2 g niat kyknyðŸ§",netral
104,layananya bagus transparan cepat wuuuuuuuuuzzzz,positif
105,gimana mau belanja harga barang satu kg 60 ribu ongkir nya 50 jadi 110 gimana mau belanja iklan aja serba murahh buktinya kita gak bisa lagi belanja taun ke belakang ongkir cuman 20 kini 50 ribu kalau mau jual udah susah kita jual nyaa payahh,netral
106,"terbantu sekali berbelanja menggunakan lazada koin & lazada reward jadi bisa menghemat, terima kasih banyak lazada semoga jaya selalu...",positif
107,pebaiki masalah kurir nya barang udah dekat didaerah . malah tidak dikirim,positif
108,"kenapa makin kesini harganya semakin mahal padahal dulu onlineshop andalanku karena harganya murah sering ambyar ongkir gila gilaan, parah mending ke oren",positif
109,"tolong di perbaiki,,kadang barang yang di pesan nggak sesuai,, kemarin ada harga ada kwalitas,saya beli udah mahal yang dtang mlh nggak sesuai.. katanya salah packing, giliran mau di kembalikan sudah terlambat..",positif
110,"Karena lazada ini bagus aplikasinya tapi ongkir nya yang mahal bisa gak usah ongkir nya,terus terkadang sepupu saya mendapatkan barang palsu di toko lazada jadinya saya beri bintang 2 aja bikin meresahkan masyarakat Indonesia",netral
111,"kali ini saya kecewa, komplain digagalkan oleh sistem lazada yang makin bobrok.. padahal sudah cukup bukti kalau barang yang saya pesan kosong. auto uninstal.",negatif
112,lazada baik sekali barang nya sampai tepat waktu dan harga nya murah produk nya bagus bintang ðŸŒŸðŸŒŸðŸŒŸðŸŒŸðŸŒŸ,positif
113,"sudah nggak ada gratis ongkirnya, jadi malas belanja.",netral
114,lazada yg terbaik sangat mendukung pelangganÂ²nya,positif
115,"aplikasi ga guna, muncul mulu iklannya gabisa di tutup lagi, selalu bolak-balik ke aplikasi lazada.",negatif
116,"Harga tidak sesuai tertera setelah di checkout,,,hati hati juga yg menggunakan paylater karna dendanya mahal angsuran saya 70.000 telat 2 hari jadi 150.000 dendanya 80000 melebihi angsuran dan tidak nyaman karna ditelpon/wa terus gk kayak aplikasi sebelah denda murah dan nyaman",negatif
117,"hahdeeh sekarang ongkir lazada mahal banget, vocer gratis ongkirnya juga dikit padahal dulu ini lazada paling gratis ongkir kok sekarang kalah lagi sama Shopee , main game lazada juga disebut persulit hadiah di kasih dikit juga maaf kasih rating 1 soalnya emang se faakta itu cih",netral
118,mempermudah berbelanja dan banyak gratis ongkir,netral
119,iklan selalu muncul ganggu,negatif
120,"ini knp ya apknya? pdhl kemarin baru aja masuk trs tb"" besoknya saya buka lagi akun saya ga ada. akun saya di kunci dengan alasan keamanan lalu saya di suruh telepon tapi saya telepon ga bisa bisa selalu di tutup ini gmn sii akun saya ga ada!, kemarin saya baru aja pesan paket saya dan saya mau mengecek paket saya sudah sampai mana ehh pas saya buka apknya akun saya g adaa ini gmn ya ?? tolong penjelasannya.",negatif
121,"Lazada membantu konsumen dalam pembelian barang apalagi dengan gratis ongkir. Sayangnya penjual masih ada yang licik, menipu dengan mengirim barang yg tdk sesuai dengan yg ditawarkan.",positif
122,"lazada penyedia kebutuhan yg baik dan aku selalu mudah belanja disini aku senang ,tetapi achir2 ini aku kok kesulitan belanja tentang pembayaran melalui cod ,sedang aku orang awam kenapa kok sulit masuk ke cod ,selalu diarahkan ke yg lain yg aku gak paham mohon konfirmasi trimakasih sehingga aku kerepotan belanja kenapa",netral
123,sangat memuaskan seklai pengiriman cepat,positif
124,"Tiap hari ngumpulin vocer + coin, gk ada yg brguna 1 pun. Sekarang ongkirnya malah semakin d luar angkasa.",positif
125,sangat memuaskan belanja d lazada,positif
126,saya suka belanja di lazada tapi saya GK pernah dapat hadiah dari lazada please hadiahnya ya,positif
127,"ntah kenapa akhir"" ini aplikasi lazada ngecewain, kemot lagi bagian hadiah koinnya. terus kasih voucher juga ga wort in sekarang mah. padahal dulu lazada jadi aplikasi favorit aku bgt.. semoga kedepannya kembali baik lagi lazaa",positif
128,"suka banget dan gampang belanjanya ðŸ˜ Cuman kalau bisa jangan lebih mahal ongkirnya daripada barangnya ðŸ™ðŸ™ya kalau bagi saya ya hanya berat di ongkirnya,, ðŸ™ðŸ™ðŸ™",netral
129,"aplikasi apa ini orang udah bayar pake qris, status pembayaran nya ga berubah.. udah lah ga ada free ongkir atau voucher momen tanggal kembar..",negatif
130,sangat terbantu dan sangat puas belanja di sini,positif
131,mudah dan terpercaya byk gratis onkirnya.pengembalian barang/return jg sangat mudah.kurirbya rama2,positif
132,"sy suka cara memuaskan pelanggan dan trik bisnis yg bagus, semua manuver dalam membina tercipta nya simbiosis mutualisme sangat di jaga dengan erat. sukses selalu lazada",positif
133,"Pesanan tiba-tiba dibatalkan otomatis dari lazada, cashback 50k jadi hangus padahal saya nggak batalin pesanannya sama sekali. Sudah dihubungi CS tapi yah abaikan katanya yang penting barang sudah diterima, tapi saya mana ikhlas apalagi cashback nya lumayan besar buat saya.",negatif
134,CS LIVE BOTT SUSAH BANGET DIHUBUNGI. DAN AKUN TIDAK BISA CHECKOUT PADAHAL AKUN UTAMA YANG BIASA BELANJA. MASA HARUS BELI HP BARU BIAR BISA CHECKOUT DI LAZADA. PARAH BANGET SIH. nyusahin yang mau belanja,negatif
135,"aplikasi bagus sangat membantu,saran sya tlong di jga ketat terutama penjual yg penipu yg merugikan pembeli",positif
136,loginnya susah..udh kaya mbanking aja no hp hrs terpasang+adakuota data aktifðŸ‘Ž,netral
137,"puas belanja di lazada krna respon cepat dn ramah, selalu ada discount dan promo menarik lainnya,",positif
138,"makin kesini makin pelit sama disc ongkir, dulu belanja 10rb ongkir 4rb, skrg harus belanja 50rb dulu baru ada potongan ongkir, GAK JELAS.. AUTO HAPUS APLIKASI",netral
139,"hp diformat mau masuk lg minta verifikasi,,,verifikasinya gmn coba??? hp yg dipake,,,ada pesanan lg????? hadeuhhhh kacau nih aplikasi",negatif
140,Keren sekali lazada semoga kedepannya bisa lebih keren aminn,positif
141,"Saya pengguna apk ini sudah lumayan lama, dan dulu apk-nya masih bagus aja. Sekarang apk ini kenapa jadi bug banget, padahal jaringan di HP saya bagus' aja tapi kenapa masih tetap bug (loadingnya lama banget, kayak jaringannya ngga stabil). Tolong dong developer diperbaiki lagi ya, terima kasih.",netral
142,paling hemat belanja ya di LAZADA.ðŸ¥°,positif
143,belanja lewat lazada sangat mudah dan aman juga cepat sampai serta banyak diskon dan bisa tambah coin juga banyak gratis ongkir harga jd lebih murah...oke lah lazada mantap..!!,positif
144,harga ya murah2 kualitas oke,positif
145,"aplikasinya sih mantep, kurir paling gercep, tapi sayang.... di saat yang lain pada bikin promo gratis ongkir tanpa minimal belanja dengan syarat, (shopee VIP, tokped PLUS) LAZADA malah naikin batas minimal belanja! Rindu Lazada yang dulu, gratis ongkir tanpa syarat minimal belanja 20k",netral
146,sekarang gratis ongkir jangkauan nya terlalu mahal. dah kalo beli barang yang murah jadi Gak gratis ongkir lagian pas dulu biasanya semua nya gratis ongkir tapi makin ke sini malah makin mahal ongkir nya jarang yang dekat pun cukup mahal . saya pengguna cukup lama apk inih tadi makin ke sini gratis ongkir nya cuman ada di iklan buka di apk nya,netral
147,aplikasi gak jelas akun tidak ada apaÂ² tiba tiba di kunci lewat lazada bagian mana,negatif
148,selalu suka belanja di lazada .. ga pernah kecewa.. pengiriman cepet banget,positif
149,"percuma belanja di lazada biar ada diskon biar ada promo biar belanja pertama atau apalah itu,kurirnya pada gak loyal buktinya pesanan saya 2 x di return dan gak ada kejelasan cuman karena nominal harga minim",positif
150,"sudah lama aku pake lazada, menguntungkan buat para pedagan",negatif
151,"saya mohon untuk kedepan nya bisa dikurangi penjual yang menjual barang yang tidak sesuai gambar dan kualitas nya kurang bagus, saya pernah membeli sendal yang lumayan mahal bagi saya tetapi belum seminggu sudah copot sendal nya, saya mohon untuk kedepan nya bisa diperbaiki dengan lebih baik dan aman. Terimakasih untuk perhatian nya dari pihak Lazada ðŸ™ðŸ»ðŸ™ðŸ»",positif
152,"Baru masuk ke lazada nih tertarik dengan iklanÂ² nya .udah masuk dan langsung belanja ,bener juga kata tetangga banyak yg ketipu sama seller nya barang tidak sesuai dengan yg di iklan/promosikan",negatif
153,Lazada ongkir masih mahal.. coba klo beban ongkir diturunin..pasti semua berpindah ke Lazada,netral
154,semoga barang nya selalu bagus gak ngecewain pelanggan,positif
155,"sudah lama tidak belanja lagi disini,karena ongkir nya yang mahal. di iklan nya gratis ongkir,tp kenyataan nya pake ongkir dan mahal lagi. jadi pindah ke Shopee dan tokopedia yang bener2 gratis ongkir",netral
156,"hai lazada bisa di bikin gratis ongkir ga pas lagi pembayaran cod? masa ongkir nya 10 rb mahal banget padahal harga asli nya ga segitu. misal:beli bantal harga asli 7 RB pas udh di check out jadi 17 RB. so, benerin lagi ya dari segi ongkir,bentuk yang ga sesuai dengan gambar, pelayanan dan sebagainya.klo udh benerin di update selanjutnya baru saya kasih bintang 5 ,oke ðŸ‘Œ",netral
157,ga lagi2 saya belanja pake lazada pylater. tagihan sudah saya bayar lunas. di tagih denda 80.000 lesing ajah denda 4500-6000 of pake lazada pylater...!!!,negatif
