,reviews,Prediksi
158,"kenapa lazada sering ada paket ke rumah yang saya aja ga pesen udah gtu cod,, udah ke 3 x nyaðŸ˜­ shopee tiktok ga pernah kaya gini loh!!",netral
159,"lihat produk harganya semua ""Rp.0,-"" Nol rupiah. setelah cekot berbeda. Tolong kasih harga sebenarnya, jangan tipu-tipu. Aku muak dengan promo busuk, aku pengguna lama.",positif
160,sdh tak rekomended.. ongkirnya ga ngotak.. dulu sering order krn gratis ongkir dan cepat.. skrg ongkir mahal dan klo cash datengnya lama.,netral
161,udah beberapa kali beli barang dilazada pas dateng banyak yang ga sesuai!! dikomen 100% real pas dateng 0%. saya beli cushion g2g yang datang malah blush-on lameila sangat jauh sekali dari cushion jadi blush-on,netral
162,"pengalaman belanja paling najisss, gratis ongkir ga ada giliran dapet produk murah barang nya ga di kirim akhirnya di batalin otomatis sama pihak lazada/toko nya. males pake lazada, aplikasi sebelah lebih jelas dan bagus",netral
163,"pesanan saya jarang di kirim padahal sudah di bayar, mengajukan pengembalian selalu di tolak. banyak penjual curang ga bertanggung jawab tidak di tindak.",negatif
164,"ok sy edit ulasan sy, tolong pertimbangkan lg soal denda.apa lg sy br sekali galbay diaplikasi ini.terima kasih responya",netral
165,"IKLAN LU SANGAT MENGGANGGU ,GAK MAU BELANJA DI PAKSA MASUK APLIKASI !!!!!!!",negatif
166,ah makin ga asyik ongkir mhl sampai 80rb satu jkt ttp barang ga dikirim2 terpaksa di batalkan.ongkir segitu mah di toko sebelah cm sehari,netral
167,makin sini makin. buruk ajah ni aplikasi..masa akun saya jadi tidak bisa melakukan cod lelucon macam apah ini,netral
168,aplikasi yg sangat membantu dalam proses berniaga..jadi mudah belanja kebutuhan..,positif
169,"gajelas, voucher gabisa dipake, pengguna baru gabisa dipake...",negatif
170,"memudahkan untuk belanja, maju trus lazada",positif
171,belanja d lazada emang lebih mudah praktis tak perlu ribet,positif
172,"gratis ongkir, tapi harga nya tetap segitu, sama saja tidak ada gratis ongkir nya,! rada kecewa sama lazada, harga barang nya termasuk mahal!!",netral
173,"terpaksa saya unistal, tiap mau nonton anime di bstasion, selalu muncil iklan lazada, terus masuk ke aplikasi, mengganggu banget",negatif
174,"aku belanja dlazada udh hampir 8 taun an allhamdulilah selalu amanah cuman terkadang sekali"" ada kecewa kbanyakan bagusnya",positif
175,"sukaa banget banget banget sama lazada! banyak diskon atau promo di event event tertentu, diskon nya beneran banyaakkk poll, THANKUUU SEDEKAH DISKON LAZADAAA ðŸ˜ðŸ¤©ðŸ«¶ðŸ»ðŸ˜µâ—ï¸tapii minus nya disini banyak produk yang fake dijualan di store nyaa huhu, jadi haruss pinter-pinter milihðŸ˜”",positif
176,selama belanja dilazana gk pernah kecewah,netral
177,"kecewa sama lazada,,sekarang udah ga ada,gratis ongkir,,beda sama si oren,,,harga 10rb ongkirnya 20rb,,,msh mending beli langung ga usah online,ngapain beli online klo jatuhnya lbih mahal,ðŸ¤¦ðŸ¤¦ðŸ¤¦ðŸ¤¦ðŸ¤¦",positif
178,"ni aplikasi ganggu banget selalu ada iklan di berbagai aplikasi, adahal kagak kepencet tapi tetep tertuju ke ni aplikasi...maksa banget ya suruh belanja disiniðŸ˜ðŸ˜ðŸ˜‘",negatif
179,"jelek, ongkir mahal dan pengiriman lama, busuk bgt",netral
180,pengiriman cepat tepat bnyk gratis ongkir dan bnyk hadiah game .lazada mantap keren ðŸ‘,positif
181,"dari dulu tetep pake lazada karna pengirimanya cepat, walau harus pandai2 pilah pilih barang, but its oke si, overall suka pake lazada,",positif
182,"kelewatan banget paylater nya lazada cuma telat 3 hari denda nya 80 ribu, sangatÂ² tidak memanusiai",negatif
183,gw hapus nih apk iklan nya gak ngotak datang terus,negatif
184,lazada ok..tiap pembelian barang amanah dan tidak kecewa penjual ok lazada ok,positif
185,"Terimakasih lazada sudah memberikan yang terbaik, tapi saran saya untuk penjualan yang culas atau curang tolong ditindaklanjuti alias dikasih hukuman yang jera kalau perlu dikeluarkan supaya tidak meresahkan yang lain.",positif
186,"barangnya murah murah bagus kualitasnya,tapi pengirimannya lama",positif
187,"gini amat lazada, lebih mahal ongkir ketimbang harga barang yg mau di beli. udah gitu banyak promo ini itu tapi gabisa di pake ya buat apa.",positif
188,"lazada sekarang ongkir nya makin mahal, voucher nya juga.dulu belanja 20k . ongkirnya bisa 0 rupiah.sekarang belanja 30k.cuman dpt potongan ongkir 5k. off dulu dech belanja disini.",netral
189,"sekarang lazada pengirimannya super lama,dan gaada gratis ongkir,semua barang jadi mahallll,ga kaya duluðŸ˜¢",netral
190,pesenan sesuai foto dan keinginan saya... sangat.. sangat.. memuaskan.. trimakasih lazada semoga tambah berkah tambah sukses tambah berjaya yessðŸ‘,netral
191,saldo pengembalian tidak bisa ditarik,positif
192,pesanan selalu tepat dan bagus,positif
193,verivikasi terlalu rumit n ribet pakai data seluler RUWEEEEEET,negatif
194,"belanja mudah, murah dan berkualitas",positif
195,tolong okir ya jangan mahal mahal lah masa saya beli barang 1k tapi ongkir ya 10k tolong iya turunin harga ongkir ya,netral
196,"aplikasinya makin sini makin kesana udah 3x dapet orderan fiktif,gimna sii, toko-toko tukang tipu masih aja masuk...terpaksa saya cancel karena saya gk pesen paket tiba datang aja,udah di cek di aplikasi gk ada pesanan,suka kasian sama kurir,perbaiki lagi sistemnya jangan cari untung doang sampe free ongkir aja hrs belanja 50 rbu keatas",negatif
197,info hari ini saya ingin melakukan pembayaran paylater akan tetapi halaman layanan tidak bisa di akses,negatif
198,Banyak penipu dilazada yang dibeli apa yg dikirim apa Pengembalian dana dibatalkan sepihak Kecewa jangan mau beli dilazada,negatif
199,semoga lazada lebih nyaman & aman dalam berbelanja,positif
200,"kasih bintang 2 dulu. Krn q klik harga tambah mehong, sedangkan ongkir nya selangit bosz..qiu...",netral
201,saya sangat suka karna memudakan Mencari dan membeli barang yang saya inginkan,positif
202,suka karena banyak kelipatan koin nya dan banyak gratis ongkirnya,positif
203,gue uninstall semua apk lazada di hp yang gue punya termasuk keluarga gue karena gak guna!! udah gak ada gratis ongkir giliran dapat voucher gak bisa di pakai dengan alasan resiko keamanan!! bangkrut kah kau lazada???,netral
204,"saya sangat menyukai belanja di aplikasi Lazada, karena fiturnya mudah diakses. Begitu pula dengan event atau belanja menggunakan coin, voucher, lazreward. Keren banget!! Ada gamenya juga sangat lucu dan mudah dimainkan ðŸ¤©",positif
205,mahal di ongkir udah gitu ongkir nya di Bebani ke costumer mau bebas ongkir harus beli banyak kn semua costumer beli buat jual jual lagi pantesan aja lu sepi,netral
206,"pada saat chekout akun ku ke deteck anomali atau ada pihak ketiga, padahal aplikasi pihak ke 3 nya ga pernah ku jalanin ke lazada nya,tapi ko malah akun ku kedeteck apliaksi pihak ke 3,ku hps aplikasi pihak ke 3 nya tetep ga bisa chekout,padahal dah nyaman pake lazadaðŸ˜¿ðŸ˜¿",negatif
207,"lazada emang pasang iklan dimana2 ya .. ganggu banget. kelamaan.tolong durasinya dipersingkat ,",negatif
208,"Aplikasi yang sangat bagus, tetapi di HP saya kok banyak iklan lazada si, itu sangat mengganggu, iklannya maksa lagih!!!",negatif
209,"dulu dah langganan belanja di platform ini, andalan banget tp setelah sering kecewa dengan seller yang ngirim barang ga sesuai aduh... mulai muak! dan kurirnya ga jelas! pick up retur ga diambil... pick up retur diambil status belum berubah,msih nunggu pick up, kan aneh? harusnya dibenahi biar konsumen puas!",positif
210,"Aaaa gimana yaa suka bangetttÂ² sama lazada banyak polll diskon, tapi disisi lain kurirnya itu loh bayar pake dana malah asal ngirim ke rumah lain ga sampai rumah akuuðŸ¥º, please help me, pas dibilang kurirnya malah ga terima dan ngancemÂ² gabakal bisa ada paket yg sampai kerumah aku lagiðŸ¥º.",positif
211,"mantap pokonya pesan di lazada murah pool,kurirnya ramah pengantaran tepat waktu...",positif
212,"Saya salah satu pengguna lazada sudah lebih dari 4thn, tpi kok akhir2 ini saya jadi kurang berminat berbelanja disini karena ongkir jauh lebih mahal dibanding harga barang. saya agak kecewa,, mohon untuk kedepannya bisa diperbaiki lagi seperti dulu,, terima kasih",netral
213,"Ini lazada makin parah aja, sudah egk ada ongkir gratis. harus beli di atas 90rb bari dapat potong 30rb ongkir, gmna""??? Si orange aja makin banyak belanja di tambah ongkir nya, ini makin kebalikannya. gtu mau banyak yang beli??? logikanya gmnaaaa",netral
214,"ga pernah kecewa belanja di lazada, kurirnya juga udah langganan",positif
215,belanja online terpercaya,positif
216,mudah dan harga terjangkau,positif
217,"makin males kesini sama lazada..mending pindah ke yg lain, di lazada banyak toko bodong di biarkan, harga mahal-mahal, ongkir makin mahal, di tiap aplikasi lain iklan nya dimana-mana bikin ganggu. ngeselin. jangan kebanyakan promo iklan di sana sini. iklan gak mutu juga. beresin tuh toko-toko penipu, ongkir jangan mahal-mahal.. males sama lazada..mending pindah.",netral
218,"sudah lama tidak pakai aplikasi ini..tiba2 ada email masuk ""pesanan telah disetujui, tinggal menunggu pembayaran"".. aneh sumpah",negatif
219,pokoknya good job belanja di online nggak harus capek capek keliling pasar tinggal tunggu dirumah bayar di tempat,positif
220,makin sini lazada ko makin jelek ya gada gratis ongkir harga makin gila pengiriman makin lama pelayanannya juga jelek padahal aku langganan udah lamaðŸ˜­ udah lebih dari 5tahun loh langganan lazada tadinya udah nyaman banget sekarang malah ngecewain,negatif
221,"saya kasih â­ 5, karena saya mau melihat sampai dimana gratis ongkirnya setiap pembelian.. terimah kasih",netral
222,"ð’Œð’‚ð’•ð’‚ð’ð’šð’‚ ð’ˆð’“ð’‚ð’•ð’Šð’” ð’ð’ð’ˆð’Œð’Šð’“ ð’”ð’†ð’ð’–ð’“ð’–ð’‰ ð‘°ð’ð’…ð’ð’ð’†ð’”ð’Šð’‚, ð’•ð’‘ ð’ð’šð’‚ ð’‚ð’…ð’‚ ð’ð’ð’ˆð’Œð’Šð’“ ð’ð’šð’‚, ð’‚ð’•ð’–ð’“ð’‚ð’ ð’‹ð’ð’ˆð’‚ð’ ð’…ð’Š ð’ð’†ð’ƒð’†ð’ð’Šð’ ð’ˆð’“ð’‚ð’•ð’Šð’” ð’ð’ð’ˆð’Œð’Šð’“, .",netral
223,"Sangat nyaman belanja di lazada, tepat waktu dan hemat ongkir",positif
224,untuk kurir spx express harap diperhatikan sebab klw mengantar paket klw sudah tiba tidak mau menghubungi pelanggan cuma difoto dan dikembalikan ke penjual tanpa konfirmasi ke pembeli terutama kurir yg wanita.,netral
225,"Harga tidak jelas, hanya membodoh bodihi pembeli, ongkir selalu berubah ubah discon dan promo pun sama., biaya penangan dan bla bla bla.... Lazada memakai teknik marketing yang jahat,, banyak penipuan yang tetjadi di lazada,, lazada zadah.. Langsung uninstal ajaðŸ™ pengembalian dana lama di persulit, seler kebanyakan penipuan semua, ga ada saringannya apa ni aplikasi buat seler penipu, asli kecewa betul ni..",positif
226,"sekarang minimal belanja buat ongkirnya naik, beli barang murah tapi jadi dua kali lipat karena ongkir gak masuk akal, di aplikasi lain aja barang kecil gak sampai 25k tapi disini segitu, terus tiap chat toko selalu yang balas bot gak bisa dialihkan ke penjual",negatif
227,Harapan x semoga setiap pesanan tidak mengecewakan .,positif
228,tolong aku pelanggan setia toko harus yang amanah dan jujur jgn sampe kecewa biar belanja di lazada,positif
229,belanja d aplikasi lazada lumayan puas sih. masalah ongkir tiap toko berbeda karena jarak tempuh ke tujuan. kalo d lazada dapet lazada reward yang saya cari buat tambahan belanja. saran saya banyak toko yang tidak amanah mohon d tindak lanjutin biar aplikasi lazada bersih dari toko yang tidak amanah karena barang palsu.,positif
230,sekarang sudah mulai lagi blanja di lazada sejak banyak koin dan gratis ongkir,netral
231,alhmdulillah belum pernah kecewa belanja dilazada the best olshop,positif
232,bagus sekali buat belanja barang bagus,positif
233,keren aplikasinya semoga dpt banyak diskon,positif
234,puas belanja di lazada barangnya bagus kulitnya ramah terimakasih lazada,positif
235,aplikasi jelek. customer service tidak bisa membantu sama sekali. sistem lazada tidak bagus,negatif
236,ada she sedikit kecewanya tapi aku lebih suka aplikasi ini tidak ribet banyak penawaran penawaran menarik walupun kadang ada tidak sesuainya pada saat pesan barang.tpi buat lazada terimah kasih selalu amanah,positif
237,mantap segala belanja jadi gk ribet,positif
238,"kecewa beli produk digital di sini, dana udah masuk tapi transaksi dibatalin dg alasan kadaluarsa, tapi pengembalian dana ga langsung dibalikin. seller dichat ga dibales",negatif
239,sering dpt harga murah dan berkualitas,positif
240,"males belanja dilazada, vocer ongkir nya hanya dapat digunakan seller tertentu. enakan belanja ditiktok shop/shopee vocer ongkir nya bisa dipake semua seller dan banyak promonya. lazada mah pelit ga berani bakar duit takut gulung tiker apa yakðŸ˜ª",netral
241,"pemilihan pengiriman cuma 1, ongkir nya mahal",netral
242,w langganan di lazada.. tapi belakangan ini lazada gratis ongkir nya minimal 30rbu dan 50rbu maaf saya ke aplikasi oren aja :),netral
243,belanja murah dan terpercaya,positif
244,"ini pesanan nya kenapa dobel min, pdhl saya cmn psn 1, bisa dikembalikan lagi apa tidak pesanan yg satu nya?",positif
245,sukaa bangett sama aplikasi belanja ini belanja lebih cepat dan banyak diskon dan tentunya harga ramah lingkungan pokoknya the best,positif
246,"pantas kalah saing sama aplikasi oren, Lazada terlalu mahal ongkir nya sekarang untuk arah Kalbar sampai 65 rbu,klau aplikasi Oren nda terlalu mahal ongkir nya terkadang dapat gratis ongkir,klau di Lazada ga pernah dapat gratis ongkir",netral
247,tempat belanja yang murah dan gratis ongkir,positif
248,"maaf sementara sy uninstall dlu ya lazada, karena ongkir mu semakin melambung dan notifikasi mu terlalu mengganggu semoga kedepannya semakin bagus ya. good luck!",positif
249,"ongkir mahal banget dah ngerasa beli ongkir gratis barang, banyak voucher tapi minimal blanjanya tinggi bet walaupun diskon nya dikit, iklan lu jan di sebar mulu bosen liat ilan lu tiap buka apk game,link atau yang lainya pasti ada iklan lazada mana ga bisa di close lagi langsung masuk ke lazada bt bet dah, pengiriman saldo lazada lama bet ga bisa langsung aja gitu di proses biar bisa blanja lagi kmarenÂ² di apk sebelah ada banyak bet diskon ama gratis ongkir eh saldo nya masih di proses mulu",netral
250,"produk nya mahal mahal, mending beli di shope murah murah",positif
251,moga sesuai yang di pesen terkadang suka ngecewain pelanggan nya ..kalo bisa amanah biar banyak yang peminat nya..moga sukses,positif
252,tolong lah jangan buat iklan pop up yang menganggu saya mau latihan untuk daftar sekolah pun terganggu iklan aplikasi satu ini ya otomatis terganggu fokusnya mana maksa banget buat dibuka dan liat produk boleh buat iklahn tapi jangan yang terlalu mengganggu kayak pop up dll,negatif
253,makin lemot aja susah di pencarian y.... harus nunggu buka aplikator tetangga dulu setelah klw kaya gini kalah start y dong harus ngelirik tetangga dulu sisanya baru..ðŸ¤”ðŸ¤”ðŸ¤”ðŸ˜ðŸ˜,netral
254,gratis ongkir nya suka menghilang... Shopee berlomba2 ngasih gratis ongkir biar pelanggan pada belanja... ini mah malah dipersulit gratis ongkir nya.. pantesan pas harbolnas kemarin lazada sepi pembeli.,netral
255,kenapa ya paylater sy ga bsa login lgi,negatif
256,"bertahun2 setia belanja di aplikasi ini,krn ongkir murmer dan pengiriman cepat sampai ke sabaran habis,krn selalu dpt barang yg tdk sesuai dgn pesanan dari seller nya sehingga akhirnya saya sekeluarga pindah ke toko orange ðŸ‘ðŸ˜ƒ waw",positif
257,lebih banyak lagi geratisan ny untuk biaya lailainya,netral
258,"sudah bertahunÂ² pake aplikasi ini,, belanja apapun selalu ngandelin lazada,, sebulan bisa abis berjutaÂ² buat belanja, terasa akhirÂ² ini lazada mulai membosankan mengenai gratis ongkir yang tidak masuk akal, nominal belanja biar dapat gratis ongkir semakin kesini semakin tinggi,, nominal ongkir dibatasi dan dikasih tempo sebulan hanya mendapatkan gratis ongkir beberapa kali belanja saja,,, aneh sekali. semoga lekas diperbaiki.",netral
259,"bgus... tapi tolong diperbaiki lgi mslh ongkir nya ya Lazada,klu beli bnyk Seharusny ongkirny lebih murah knp ini Mlah mkin mahal.ðŸ™ðŸ»",netral
260,"Kadang ada juga penjual yg gak amanah,untuk pelayanan aplikasi mantap",positif
261,kenapa akunku sudah 3 minggu ngk dikasih gratis ongkir sangat mengecewakan karena tidak bisa chekout padahal aku suka sekali belanja di lazada tolong diperhatikan kriti dan saran kostumer,netral
262,Sadis berbelanja dsini......ongkirnya harga nyawaðŸ¥º mau melakukan belanja pertama tapi mengerikan....,positif
263,"untuk sementarah dulu *Â¹ jiKa berikan dulu di aplikasinya lazadahnya'! kitanya ini! maaf sebelumnya.. ..... ... .. ...... .... . saya akan mengikutinya dan akan memberikan *****âµ Ki di aplikasi nya kita ini. kalau pesanan ku itu udah sampai disini, jika paket yg saya pesan itu udah ada digenggaman ku. semoga yg sya pesan itu, paket ku itu pasti sampai disini'! sesuai harapan. ngga seperti kemarin"" nya, udah membuat sya kecewa#kerena ada kesalahannya. kerena 1 hal udah mmbuatku sburuk it.",positif
264,"mantap, sangat membantu dalam memenuhi kebutuhan sehari-hari",positif
265,mantap belanja di sini barangnya murah meriah,positif
266,"Makin gakbjelas, proses pengiriman sangat lambat. Saran saya kirim aja ke nerak lagi pesanana itu. Biar di terima setan disana. Lazada pun sampaj saat ini hanaya mikir keunuungan dari yiap pesnanata layanan cod, tampa mikir hak konsumen. Mulai saat ini saran janagan pake aplikasi LAZADA. UNINSTALL APLIKASI SAAT INIJUGA makin lama aplikasi Lazada makin tak jelas",negatif
267,stop belanja dulu di apk ini.. Lazada ongkirnya mahal gak kayak dulu lagi...... Kecewa sih..ðŸ˜¤,netral
268,"menurut saya benda-benda tajam yang dijual di aplikasi seperti ini membuat takut,jantungan dan mengerikan",netral
269,lazada senantiasa sll menjaga kualitas produk yg ditawarkan,positif
270,"pengguna lama lazada, tp lazpaylatter nya ga muncul juga, kecewa",negatif
271,"Sukak bnget belanja disini, tapi sayang bnget gratong nya DIKITT kek pelit kali lah, pliss kasih gratong kasian aku lah mau belanja di tempat fav eh malah gak ada gratong. Lama' beralih ke oren nih.",netral
272,"mana diskon nya cuma yang pentingÂ² doang diskon nya,baju sama lain enggak ada,",positif
273,tempat belanja menyenangkan bisa bayar pake pay later,positif
274,belanja mudah banyak diskon dan gratis ongkir pelacakan pengiriman paket jelas dan akurat.,positif
275,"barang sudah di kembalikan tp masih muncul penagihan, terus dapat email dah sy balas dan kirim bukti2nya katanya g merespon email dari pihak TSB akhirnya akun sy di bekukan dan sy g mau pusing sy bayar",negatif
276,"Bagus..cuma masih ada seller yg jual barangnya tidak sesuai dgn apa yg di promosikan.Utk meningkatkan kwalitas dan kepercayaan customer terhadap LAZADA,tolong seller yg tak amanah atau cuma nipu di blok saja.Jangan shopee,byk seller yg nipu.Terima kasih.",netral
277,Alhamdulillah sangat amanah sesuai dengan pesanan,positif
278,"Apk nya bagus dan friendly user, ditambah lagi bonus vocer dan diskon, Thankyou Lazada Indonesia",positif
279,"saya baru rilis bosku mudah-mudahan barang ya pas seperti di promo,, ok punya",positif
280,aplikasi berguna saya membeli helikopter walaupun belum datang tapi mohon pengiriman nya di maksimalkan 7 Karna yang pengen banget tapi lama ngerasain main nan nya lama kalo gak boleh gak PP terimakasih sekian,negatif
281,iklannya sangat mengganggu aktivitas,negatif
282,serba ada dan pengiriman cepat ðŸ‘ðŸ¾,positif
283,bisa belanja paling sejarah dan suka dian ya tapi ada ongkir ya 21.500 saja,positif
284,Terima kasih google play store Saya sudah bisa menggunakan aplikasi lazada buat mencari produk yang berkualitas bagus bukan kw dan mau belanja di toko yang amanah kalau ada toko yang suka nipu tolong di blok aja.!,positif
285,"tempat belanja Paling ok,tetaplah jadi yg terbaik...Lazada ok",positif
286,selalu puas belanja dilazana membantu ibu rumah tangga kaya saya diskon nya super2 apalagi permainan yg dapat lazrewand mksh lazada banyak membantu,positif
287,lazada harus bersih2 seller nakal pesen A datang B dari segi ongkir lazada paling murah dari yg lain saya yakin lazada kalau bisa beresin permasalahan seller nakal orang-orang bakal kembali belanja ke lazada karena banyak bonusnya dan ongkir gratis nya sekian saran saya buat pihak Lazada,positif
288,Opsi pemesanan barang sangat mudah utk dipahami. Good job ... !!!,positif
289,nyaman belanja di lazada ..,positif
290,"Makin parah aja nih lazada, masa saya beli paket di promo 99 tapi di batalkan, terus saya chat seller nya katanya pihak lazada yang membatalkan, apakah voucher 99 tersebut hanya lah gimik semata, kacau sih mending beli di e-commerce sebelahðŸ™‚ update 2025: lazada makin parah aja mesen paket tapi selalu aja mengalami kegagalan pengiriman padahal alamat dan patokan udah saya sesuai kan dengan yang ada di google maps haduh ini udah kesekian kalinya loh",negatif
291,"Apk stres lagi seru seru nonton film malah di kasih iklan yang ga jelas, mau pencet tombol X nya malah masuk ke apk nya. Ngasih iklan kayak ngasih virus, apk rusak apk rusak",negatif
292,"lazada sekarang sangat jelek, kurir jelek toko jelek aplikasi jelek, paket saya tidak di kirim kirim, pokoknya semoga gak pada pake lazada lagi deh, kita bareng bareng pindah ke olshop sebelah aja yang lebih mengutamakan penggunanya, mending tutup aja aplikasi lazada, jangan download aplikasi ini, sangat buruk sekarang.",negatif
293,wah inimah bagus banget aku suka banget aku kasih bintang lima 5 untuk lazada,positif
294,Harus perbanyak bonus dan kalo bisa ongkir gratis di semua item . Tingkatkan pelayanan yg LBH bagus dg mnjual barang barang berkualitas. satu hal lagi untuk pengiriman sangat bagus dan cepat. sekali lagi tingkatkan pelayanan.anjakqn para pelanggan. pelanggan adalah raja,positif
295,promo pejualnya hanya sekali itu mengecewakan,positif
296,menjadi sponsor di banyak aplikasi durasinya lama tiba-tiba masuk ke aplikasi lazada kan meresahkan,negatif
297,"yg paling gw ga suka itu setiap chat toko, pasti yg jawab AI ini mnrt gw ga guna, ga guna sama sekali biarkn lh penjual yg jawab, knpa msti AI?? lu macm tanya operator seluler yg lagi urgent trs yg jwb AI, gendek ny itu na'udzubillah",negatif
298,bagus banget kalo bisa dikasih diskon setiap hariðŸ˜œ,positif
299,bertahun2 pakai paylatter lancar jaya. giliran telat baru 2 hr aja sdh ky utang puluhan juta aja ngejarnya. cukup deh bakal uninstal kl gitu,positif
300,semoga aplikasi ini sangat membantu dan kumohon penjual yang menggunakan aplikasi ini lebih jujur lagi,positif
301,"pelayanannya sudah lebih baik dari kemarin kemarin,semoga sukses selalu.",positif
302,"fitur tab lazkoin ada reward cek-koin dan pilihan otomatis kenapa setiap berhenti di reward 100k or 150k dan koin 4444 selalu nge'lag???? tapi kalo kalo di 30% 66% dan koin 1-10 langsung otomatis dapet?!? kalo ga niat ngasih reward ngapain bikin fitur begitu dah, aneh!!",netral
303,"saya pengguna lama lazada...dan hari saya agak kecewa karena tida bisa masuk di akun saya, ditambah paylater saya jatuh tempo kemarin bayar nya kok menbengkak sampai 20x lipat..yg harus nya saya bayar 13 ribu..jadi 250 ribuan gilaa padahal nbaru 1 hari lewat",negatif
304,aplikasinya keren dan mantap order dan bisnisnya murahr bagus2 dan cepat nyampai bisa cod lag,positif
305,"makin ke sini makin gk jelas ongkir..malah jdi sama harga yg ada d toko malah ini jdi lebih mahal....maka y skrang lazada d daerah ku kurang laku jdi pada pindah ke sopi...mantap sopi,lazada buruk",netral
306,"Lazada sekarang jelek banget. gaada gratis ongkir, voucher banyak tapi ga guna karena min. pembelian 80k keatas, aplikasi kadang suka ngelag, terlalu berat. tapi untuk pengirimannya oke sih, 2-3 hari udah nyampe rumah (diluar libur nasional). saya kasih bintang 2 dulu soalnya sekarang ongkirnya makin mahal, gak full gratis ongkir.",netral
307,banyak belanjaan yang menarik,positif
308,banyak iklan mengganggu,negatif
309,"tolong lah lazada, masa mau search yg kedua kali gabisa, harus relog, mana ada produk baju wanita, tapi yg ditampilkan body wanitanya, kalo di liat orang tua saya gimana? di hapus gabisa, di laporin loading doang, gabisa di klik, padahal jaringan saya bagus lohh, main game lancar, buka all sosmed lancar, tolong di update lagi, ini sangat ngeselin, tambahin fitur hapus produk yg tidak kita suka, itu aja makasih",netral
310,"saya pengguna lazada sudah lama, tapi lama kelamaan kenapa ongkirnya jadi makin mahal, klo dulu biasanya slalu dpt vocer gratis ongkir tanpa minimal pembelian, sekarang malah kbnyakan harus beli produk 70rb ke atas baru bisa gratis ongkir,",netral
311,slama memakai apk ini allhamdulillah lancar jya bloom pernah ada problem,positif
312,"aku stop blanja di lazada Krn selalu kena ongkir, GK kaya dl yg gratis ongkir nya melimpah masa pengguna baru pun kena ongkir.. TDK seperti aplikasi Oren dan hijau yg welcome pengguna baru dgn byk benefit dan keuntungan, voucher yg menggiurkan... JD pilihannya cm blanja di choice yg gratis ongkir... byk jg seller2 yg TDK amanah di biarkan oleh lazada...pernah kecewa sih KL blanja pakaian d azada n Bikin kapok, mending toko oyen byk cara untuk dapetin diskon/pot harga dr live vidio atau lainnyðŸ™",netral
313,"sekarang susah dapat gratis ongkir dari Lazada, makin tertinggal sama oren, bakalan pelan2 nyusul buk@lapak kayaknya kalo begini terus ðŸ™ðŸ˜€",netral
